name	kind	owner	notes
RuntimeOwner	struct	crates/redis-server/src/runtime_owner.rs	Planned owner of normal command execution; not default until oracle evidence says so.
ClientSlot	struct	crates/redis-server/src/runtime_owner.rs	Planned owner-loop representation of one connected client.
RuntimeEvent	enum	crates/redis-server/src/runtime_owner.rs	Planned event channel from background systems into the owner loop.
RuntimeOwnerConfig	struct	crates/redis-server/src/runtime_owner.rs	Typed knobs for owner-loop experiments; must not alter default behavior silently.
CommandContext	struct	crates/redis-core/src/command_context.rs	Existing command API; migration target must preserve normal dispatch semantics.
RedisDb	struct	crates/redis-core/src/db.rs	Existing DB state; owner-loop migration should move ownership, not duplicate live DB models.
